{
  "schema_version": "2.0.0",
  "corpus_id": "claim-support-calibration-2026-08-11",
  "status": "frozen",
  "policy": {"support": "The cited evidence set, read together and without outside knowledge, entails the entire claim.", "accept_label": "entailment", "outside_knowledge": false},
  "coverage": {"required_categories": ["exact_support", "faithful_paraphrase", "contradiction", "neutral_related", "missing_qualifier", "negation", "double_negation", "wrong_entity", "wrong_population", "wrong_intervention", "wrong_comparator", "wrong_outcome", "wrong_number", "wrong_unit", "wrong_confidence_interval", "wrong_statistical_significance", "causal_overreach", "temporal_overreach", "study_stage_overreach", "modality", "quantifier", "narrower_scope", "broader_scope", "bibliography_only", "fragmented_subject", "fragmented_object", "supported_compound", "partial_compound", "genuine_multi_source", "false_multi_source_relation", "conflicting_evidence", "evidence_order", "irrelevant_padding", "long_context", "over_budget", "healthcare", "scientific", "adversarial_lexical_overlap"]},
  "cases": [
    {"id":"cal-exact-001","partition":"calibration","status":"adjudicated","claim":"The external validation sensitivity was 0.91.","evidence":["The external validation sensitivity was 0.91."],"categories":["exact_support","scientific"],"critical":false,"phi":false,"annotation":{"label":"entailment","rationale":"The claim exactly matches the result.","material_components":["external validation","sensitivity 0.91"],"supporting_spans":[{"evidence_index":0,"text":"The external validation sensitivity was 0.91."}],"refuting_spans":[]}},
    {"id":"cal-paraphrase-001","partition":"calibration","status":"adjudicated","claim":"Protocol amber lowered review errors by 37%.","evidence":["Review errors fell by 37 percent under protocol amber."],"categories":["faithful_paraphrase","wrong_number"],"critical":false,"phi":false,"annotation":{"label":"entailment","rationale":"The wording changes but the entity, direction, and value are preserved.","material_components":["protocol amber","review errors decreased","37 percent"],"supporting_spans":[{"evidence_index":0,"text":"Review errors fell by 37 percent under protocol amber."}],"refuting_spans":[]}},
    {"id":"cal-negation-001","partition":"calibration","status":"adjudicated","claim":"The intervention did not increase serious adverse events.","evidence":["No increase in serious adverse events occurred with the intervention."],"categories":["negation","healthcare"],"critical":false,"phi":false,"annotation":{"label":"entailment","rationale":"Both statements deny an increase in the same outcome.","material_components":["intervention","no increase","serious adverse events"],"supporting_spans":[{"evidence_index":0,"text":"No increase in serious adverse events occurred with the intervention."}],"refuting_spans":[]}},
    {"id":"cal-double-negation-001","partition":"calibration","status":"adjudicated","claim":"The device was available.","evidence":["The device was not unavailable during the assessment."],"categories":["double_negation","faithful_paraphrase"],"critical":false,"phi":false,"annotation":{"label":"entailment","rationale":"Not unavailable entails available in this explicit binary context.","material_components":["device","available during assessment"],"supporting_spans":[{"evidence_index":0,"text":"The device was not unavailable during the assessment."}],"refuting_spans":[]}},
    {"id":"cal-narrower-001","partition":"calibration","status":"adjudicated","claim":"Hospital Cedar reported improved workflow.","evidence":["All four evaluated hospitals, including Hospital Cedar, reported improved workflow."],"categories":["narrower_scope","quantifier"],"critical":false,"phi":false,"annotation":{"label":"entailment","rationale":"The universal statement entails the named hospital instance.","material_components":["Hospital Cedar","improved workflow"],"supporting_spans":[{"evidence_index":0,"text":"All four evaluated hospitals, including Hospital Cedar, reported improved workflow."}],"refuting_spans":[]}},
    {"id":"cal-compound-supported-001","partition":"calibration","status":"adjudicated","claim":"Model Pine had 0.91 sensitivity and 0.84 specificity.","evidence":["Model Pine had sensitivity of 0.91 and specificity of 0.84."],"categories":["supported_compound","scientific"],"critical":false,"phi":false,"annotation":{"label":"entailment","rationale":"Both coordinated measurements are explicitly stated.","material_components":["Model Pine sensitivity 0.91","Model Pine specificity 0.84"],"supporting_spans":[{"evidence_index":0,"text":"Model Pine had sensitivity of 0.91 and specificity of 0.84."}],"refuting_spans":[]}},
    {"id":"cal-multisource-supported-001","partition":"calibration","status":"adjudicated","claim":"The intervention reduced errors in cohorts A and B.","evidence":["In cohort A, the intervention reduced errors.","In cohort B, the intervention reduced errors."],"categories":["genuine_multi_source"],"critical":true,"phi":false,"annotation":{"label":"entailment","rationale":"Each source supports one required cohort component.","material_components":["reduced errors in cohort A","reduced errors in cohort B"],"supporting_spans":[{"evidence_index":0,"text":"In cohort A, the intervention reduced errors."},{"evidence_index":1,"text":"In cohort B, the intervention reduced errors."}],"refuting_spans":[]}},
    {"id":"cal-health-unit-001","partition":"calibration","status":"adjudicated","claim":"The synthetic specimen measured 5 mg/L.","evidence":["The synthetic specimen concentration was 5 milligrams per liter (mg/L)."],"categories":["healthcare","wrong_unit","faithful_paraphrase"],"critical":false,"phi":false,"annotation":{"label":"entailment","rationale":"The value and explicitly expanded unit match.","material_components":["synthetic specimen","concentration 5 mg/L"],"supporting_spans":[{"evidence_index":0,"text":"5 milligrams per liter (mg/L)"}],"refuting_spans":[]}},
    {"id":"cal-ci-supported-001","partition":"calibration","status":"adjudicated","claim":"The effect estimate was 1.4 with a 95% CI from 1.1 to 1.8.","evidence":["The estimated effect was 1.4 (95% confidence interval, 1.1 to 1.8)."],"categories":["wrong_confidence_interval","scientific","faithful_paraphrase"],"critical":false,"phi":false,"annotation":{"label":"entailment","rationale":"The estimate, confidence level, and interval endpoints match.","material_components":["estimate 1.4","95% confidence interval 1.1 to 1.8"],"supporting_spans":[{"evidence_index":0,"text":"1.4 (95% confidence interval, 1.1 to 1.8)"}],"refuting_spans":[]}},
    {"id":"cal-existential-001","partition":"calibration","status":"adjudicated","claim":"At least one evaluated site improved.","evidence":["Three of four evaluated sites improved."],"categories":["quantifier","narrower_scope"],"critical":false,"phi":false,"annotation":{"label":"entailment","rationale":"Three improving sites entails at least one improving site.","material_components":["existence of an evaluated site","improvement"],"supporting_spans":[{"evidence_index":0,"text":"Three of four evaluated sites improved."}],"refuting_spans":[]}},
    {"id":"cal-order-a-001","partition":"calibration","status":"adjudicated","claim":"The trial enrolled adults and used random allocation.","evidence":["The trial enrolled 120 adults.","Participants were randomly allocated."],"categories":["evidence_order","supported_compound"],"critical":false,"phi":false,"annotation":{"label":"entailment","rationale":"The evidence union supports both clauses.","material_components":["adult enrollment","random allocation"],"supporting_spans":[{"evidence_index":0,"text":"The trial enrolled 120 adults."},{"evidence_index":1,"text":"Participants were randomly allocated."}],"refuting_spans":[]}},
    {"id":"cal-order-b-001","partition":"calibration","status":"adjudicated","claim":"The trial enrolled adults and used random allocation.","evidence":["Participants were randomly allocated.","The trial enrolled 120 adults."],"categories":["evidence_order","supported_compound"],"critical":false,"phi":false,"annotation":{"label":"entailment","rationale":"Reversing evidence order does not change support.","material_components":["adult enrollment","random allocation"],"supporting_spans":[{"evidence_index":1,"text":"The trial enrolled 120 adults."},{"evidence_index":0,"text":"Participants were randomly allocated."}],"refuting_spans":[]}},
    {"id":"cal-padding-supported-001","partition":"calibration","status":"adjudicated","claim":"Model Spruce sensitivity was 0.89.","evidence":["Administrative meetings occurred monthly.","Model Spruce sensitivity was 0.89.","The appendix used blue headings."],"categories":["irrelevant_padding","exact_support"],"critical":false,"phi":false,"annotation":{"label":"entailment","rationale":"The decisive span entails the complete claim; irrelevant padding does not reverse entailment under the stated policy.","material_components":["Model Spruce","sensitivity 0.89"],"supporting_spans":[{"evidence_index":1,"text":"Model Spruce sensitivity was 0.89."}],"refuting_spans":[],"relevant_spans":[]}},
    {"id":"cal-long-supported-001","partition":"calibration","status":"adjudicated","claim":"External validation specificity was 0.88.","evidence":[{"prefix":"","repeat":"Synthetic background describes administration and documentation.","count":90,"suffix":"External validation specificity was 0.88."}],"categories":["long_context","over_budget","scientific"],"critical":false,"phi":false,"annotation":{"label":"entailment","rationale":"The decisive result appears exactly at the end of the generated evidence.","material_components":["external validation","specificity 0.88"],"supporting_spans":[{"evidence_index":0,"text":"External validation specificity was 0.88."}],"refuting_spans":[]}},